,"Come on, Get over it!",Its not a big deal!,You are being so dramatic!,I don't care about you.,Grow up.,What kind of support do you need?,Wanna talk about it?,How can I help?,"You seem upset, do you want to talk about it?",Did something happen?,"Okay, I'll give you some space.",Why are you upset?,How about a distraction?
"Go away, I'm mad at you!",1,1,1,1,1,3,2,2,3,2,3,2,2
Why are you so mean to me!,1,1,1,1,1,2,2,2,3,2,3,2,2
*Crying*,1,1,1,1,1,3,3,3,3,3,2,2,2
Stop it or I'll punch you!,1,1,1,1,1,3,2,2,3,3,3,2,2
Why is it so unfair!?,1,1,1,1,1,3,3,3,3,2,2,2,2